{
  "id": "UCZcUbwQ0ju-JJR8ncuDz0ZA",
  "name": "Les Chroniques de l'Histoire",
  "description": "Bienvenue sur \"Les Chroniques de l'Histoire\", votre rendez-vous avec le passé !\n\nNotre chaîne vous invite à plonger dans les méandres fascinants de l'Histoire à travers des récits captivants d'événements qui ont façonné notre monde. Chaque semaine, nous vous proposons un voyage dans le temps pour explorer les moments clés, les personnages emblématiques et les tournants décisifs qui ont marqué le cours de l'humanité.\n\nSi vous êtes curieux du passé, \"Les Chroniques de l'Histoire\" vous promet une expérience immersive et enrichissante. Abonnez-vous dès maintenant et rejoignez-nous dans cette aventure à travers les âges !\n\nN'oubliez pas : comprendre hier, c'est mieux appréhender aujourd'hui et préparer demain. Alors, êtes-vous prêts à remonter le temps avec nous ?\n\n#Histoire #Chroniques #VoyageDansLeTemps #Découvertes\n",
  "thumbnail": "https://yt3.ggpht.com/eSVjLARW831SgZLq_u5OaRCeXiNO9UrnWcnXXFsUSxyKrJZw3DVWfC80hBOH34Pq5ZE8AtZXgGo=s800-c-k-c0x00ffffff-no-rj",
  "public": "10-15 ans",
  "language": "fr",
  "tags": [
    "scolaire",
    "college",
    "lycee",
    "histoire"
  ],
  "videos": [
    {
      "id": "Zp-rTfFbUZo",
      "title": "FIN D'UNE ÉPOQUE : La Chute De Napoléon Bonaparte",
      "description": "Explorez la célèbre défaite de Napoléon Bonaparte à Waterloo en 1815. Découvrez les événements clés, les stratégies militaires et les conséquences historiques de cette bataille décisive. Un regard détaillé et captivant sur un moment crucial de l'histoire européenne.\n\n00:00 - Introduction\n00:29 - Introduction à la Bataille de Waterloo, présentation du contexte de la bataille et des principaux acteurs impliqués.\n03:11 - Analyse détaillée des stratégies de combat employées par Napoléon Bonaparte et les forces opposées.\n06:56 - Les points tournants de la bataille qui ont conduit à la défaite de Napoléon.\n11:08 - Les conséquences immédiates de la bataille et leur impact sur Napoléon et ses forces restantes.\n13:27 - L'impact à long terme de la Bataille de Waterloo sur l'histoire européenne et l'héritage de Napoléon.\n\nMusic: \"Despite\" by Udio (http://udio.com)\nOverlay by https://www.vecteezy.com",
      "duration": "PT16M24S",
      "published_at": "2024-08-29T08:35:49Z",
      "thumbnail": "https://i.ytimg.com/vi/Zp-rTfFbUZo/hqdefault.jpg",
      "tags": [
        "histoire",
        "lycee"
      ]
    }
  ]
}