{
  "id": "UCENF2CqW3A4gpKocYI0cu-g",
  "name": "Les Karibous",
  "description": "Nous sommes The Karibou.\r\nNous sommes 4.\r\nNous sommes apparentés.\r\nNous sommes complétement disjonctés.\r\nNotre but: orgasmer vos oreilles.",
  "thumbnail": "https://yt3.ggpht.com/ytc/AIdro_miPTxhWkOqAgrbWaUc0ohDDdhUJHGrHJ8COwuqtuvjAA=s800-c-k-c0x00ffffff-no-rj",
  "public": "tout public",
  "language": "fr",
  "tags": [
    "musique",
    "arts"
  ],
  "videos": [
    {
      "id": "234raUsVavE",
      "title": "Smoke on the Water solo !",
      "description": "Solo de Smoke on the Water de Deep Purple, de Côme.\nGroupe de musique http://www.facebook.com/LesKaribous !!!",
      "duration": "PT59S",
      "published_at": "2013-03-19T17:47:26Z",
      "thumbnail": "https://i.ytimg.com/vi/234raUsVavE/hqdefault.jpg",
      "tags": [
        "musique"
      ]
    },
    {
      "id": "bO0xBSh1VrQ",
      "title": "Zombie Drummer",
      "description": "Mais que fait notre batteur, seul dans l'obscurité de son garage?\n\nRetrouvez nous sur Facebook: http://www.facebook.com/LesKaribous?ref=ts&fref=ts",
      "duration": "PT54S",
      "published_at": "2012-12-09T17:00:46Z",
      "thumbnail": "https://i.ytimg.com/vi/bO0xBSh1VrQ/hqdefault.jpg",
      "tags": [
        "musique"
      ]
    },
    {
      "id": "bg_EvfIGTsM",
      "title": "The Karibou's JukeBox.",
      "description": "Du délire en musique!\nA partager sans modération!\n1) Smoke on the Water/ Deep Purple\n2) Sever Nation Army/ TheWhite Sripes\n3)Billie Jean/ Michel Jackson\n4) Olé/ John Revox\n5)Riverside/ Sidney Samson\n6) I like to Move it/ Reel to real\n\nRetrouvez nous sur Facebook : http://www.facebook.com/LesKaribous?ref=hl\nMerci à Théo Esposito pour sa caméra.\nBig up à Polenta, la chatte à Olivier.",
      "duration": "PT3M37S",
      "published_at": "2012-10-14T15:53:11Z",
      "thumbnail": "https://i.ytimg.com/vi/bg_EvfIGTsM/hqdefault.jpg",
      "tags": [
        "musique"
      ]
    },
    {
      "id": "K3XFUCYr590",
      "title": "Le succès assuré !",
      "description": "Pour plus de délires : https://www.facebook.com/LesKaribous",
      "duration": "PT26S",
      "published_at": "2012-10-11T19:27:38Z",
      "thumbnail": "https://i.ytimg.com/vi/K3XFUCYr590/hqdefault.jpg",
      "tags": [
        "musique"
      ]
    },
    {
      "id": "e00gwJDBc5w",
      "title": "\"C'est toi que je t'aime\" (cover) par \"THE KARIBOU\" les Inconnu",
      "description": "C'est toi que je t'aime des Inconnus par THE KARIBOU!\nC'est tout simplement la foliiiiiiiiiiiiiiiiiiiie!\n\nVidéo originale: http://www.youtube.com/watch?v=1C3Mc53fm7Y\nNotre Facebook: http://www.facebook.com/LesKaribous?ref=ts&fref=ts\n\nBONUS: OUI on peut avoir la sensation que ça a été filmé avec un toaster Mais au moins le son est correct ;).",
      "duration": "PT2M37S",
      "published_at": "2012-10-01T01:44:26Z",
      "thumbnail": "https://i.ytimg.com/vi/e00gwJDBc5w/hqdefault.jpg",
      "tags": [
        "musique"
      ]
    },
    {
      "id": "LZFw4EfrbrA",
      "title": "Pelican The Karibou",
      "description": "The Karibou live in Barbentane.\n\nVoici notre toute première vidéo ET notre toute première compo !\n\nTenez vous prêt pour plus de folie à venir!",
      "duration": "PT4M23S",
      "published_at": "2012-09-25T20:28:44Z",
      "thumbnail": "https://i.ytimg.com/vi/LZFw4EfrbrA/hqdefault.jpg",
      "tags": [
        "musique"
      ]
    }
  ]
}